{
  "$schema": "https://json-schema.org/draft/2020-12/schema",
  "$id": "https://schemas.fortemi.dev/knowledge-shard/2.1.0/contract.schema.json",
  "title": "Knowledge Shard 2.0 authority descriptor",
  "type": "object",
  "required": [
    "$schema",
    "schemaVersion",
    "contractRevision",
    "status",
    "authority",
    "knowledgeShard",
    "profiles",
    "selection",
    "evidence",
    "presenceSemantics",
    "schemaBundle",
    "canonicalCorpus",
    "compatibility",
    "previousAuthority",
    "tracking",
    "claimPolicy"
  ],
  "properties": {
    "$schema": { "const": "https://schemas.fortemi.dev/knowledge-shard/2.1.0/contract.schema.json" },
    "schemaVersion": { "const": 1 },
    "contractRevision": { "const": "22" },
    "status": { "const": "supported" },
    "authority": { "type": "object" },
    "knowledgeShard": { "type": "object" },
    "profiles": { "type": "object" },
    "selection": {
      "type": "object",
      "additionalProperties": false,
      "required": ["default", "advertisedOptIn", "unadvertised"],
      "properties": {
        "default": {
          "const": { "schemaVersion": "1.2.0", "profile": "core-v1" }
        },
        "advertisedOptIn": {
          "const": [
            { "schemaVersion": "2.0.0", "profile": "full-v1" },
            { "schemaVersion": "2.1.0", "profile": "full-v1" }
          ]
        },
        "unadvertised": {
          "const": [
            { "schemaVersion": "2.1.0", "profile": "core-v1" },
            { "schemaVersion": "2.1.0", "profile": "record-v1" }
          ]
        }
      }
    },
    "evidence": {
      "type": "object",
      "additionalProperties": false,
      "required": ["runtimeReceipt", "fullV1InteropReceipt"],
      "properties": {
        "runtimeReceipt": { "$ref": "#/$defs/evidence" },
        "fullV1InteropReceipt": { "$ref": "#/$defs/evidence" }
      }
    },
    "presenceSemantics": { "type": "object" },
    "schemaBundle": { "type": "object" },
    "canonicalCorpus": { "type": "object" },
    "compatibility": { "type": "object" },
    "previousAuthority": { "type": "object" },
    "tracking": { "type": "object" },
    "claimPolicy": { "type": "string", "minLength": 1 }
  },
  "$defs": {
    "evidence": {
      "type": "object",
      "required": ["path", "sha256"],
      "properties": {
        "path": { "type": "string", "minLength": 1 },
        "sha256": { "type": "string", "pattern": "^[0-9a-f]{64}$" }
      },
      "additionalProperties": true
    }
  },
  "additionalProperties": false
}
